Course,SLO,Question_ID,Question_Text,Option_A,Option_B,Option_C,Option_D,Option_E,Correct_Answer
MKTG300,LO1,Q3MKTG300LO1:C,"When Heinz introduced its ketchup globally, it first had to deal with the fact ketchup is not a household staple outside the United States. Heinz had to show foreign users how ketchup can be used. This is an example of how the ________ portion of the marketing mix often needs to be adjusted when an established product is offered in a new market.",Product,Price,Promotion,Placement,Packaging,C
MKTG300,LO2,Q1MKTG300LO2:A,Which of the following statements best describes the typical target market?,"Target markets change over time as consumers drop in or out of the market, and as tastes change.","A target market will remain stable over time, including the same group of consumers.",Target markets are not strongly affected by changes in the external environment.,Target markets only change when the features and benefits of the product offering change.,"Target markets cannot be specifically defined according to age, income, or location, because these factors are continually changing.",A
MKTG300,LO2,Q2MKTG300LO2:A,The purpose of market segmentation is to:,enable the tailoring of marketing mixes to meet the needs of one or more specific groups,reduce the market down to a size the firm can handle,divide the market into equal size and profit regions for sales territories,"group a large number of markets together, enabling a company to serve them simultaneously",develop a generalized definition of the market as a whole,A
MKTG300,LO2,Q3MKTG300LO2:A,"Crate & Barrel’s target consumer in Manhattan has an annual income of between $120,000 and $250,000 while their target consumer in Cincinnati has an annual income of between $80,000 and $200,000. Which economic factor is influencing Crate & Barrel’s decision to target different income brackets with the same products in different cities?",Purchasing Power,Consumer Elasticity,Inflation,Recession,Deflation,A
MKTG300,LO3,Q1MKTG300LO3:E,"One of the reasons given for Apple’s success in the 21st century is the fact that Apple’s ecosystem of products allows for seamless transitions between Apple devices, a feature that consumers have said is important yet other brands have been unable to replicate. This seamless transition is a major ________ for Apple.",Cash Cow,Star Brand,Innovation,Promotion Strategy,Competitive Advantage,E
MKTG300,LO3,Q2MKTG300LO3:E,"In the last year Kroger has seen an overall jump in sales. However, some managers are concerned because Kroger’s percent of total grocery sales in the US is lower this year than it was last year. These managers are concerned because this means that Kroger’s ________ has shrunk.",strategic edge,revenue,competitive position,marketing strategy,market share,E
MKTG300,LO3,Q3MKTG300LO3:E,"Valerie was asked by her employer to conduct a SWOT analysis of the company. Part of this analysis includes assessing the company’s internal environment, including:",Strengths,Opportunities,Threats,Opportunities and strengths,Strengths and weaknesses,E
MKTG300,LO4,Q1MKTG300LO4:E,"Along with its iMac computer line, Apple markets its iPod, iPhone, and Apple TV products. This is an abbreviated listing of the company’s:",customer mix.,product line.,line depth.,product modification.,product mix.,E
MKTG300,LO4,Q2MKTG300LO4:E,"Over the years Cadillac has become to be thought of as “your grandparent’s car.” The new Cadillac ads show a beautiful young woman driving a Cadillac along with the statement, “When you turn your car on, does it turn you on?” This is an example of marketing designed to help _______Cadillac as a car for today’s younger driver.",diversify,display,develop,expand,reposition,E
MKTG300,LO4,Q3MKTG300LO4:E,"A potential disadvantage of multisegment targeting in which new versions of products are offered to attract new customers (e.g. a budget friendly version of a premium product) is __________, which occurs when sales of a new product cut into sales of a firm’s existing products.",synergy,positioning,demarketing,inelastic demand,cannibalization,E
